{
  "schema_version": "2.0",
  "id": "13000000-0000-4000-8000-000000000001",
  "workspace_id": "10000000-0000-4000-8000-000000000002",
  "aggregate_version": 1,
  "provider_type": "FAKE_LOCAL",
  "adapter_key": "curve.fake-local",
  "adapter_version": "1.0.0",
  "environment": "LOCAL",
  "display_name": "Synthetic local provider",
  "configuration_digest": "sha256:bbbbbbbbbbbbbbbbbbbbbbbbbbbbbbbbbbbbbbbbbbbbbbbbbbbbbbbbbbbbbbbb",
  "allowed_classifications": ["INTERNAL"],
  "secret_reference": null,
  "status": "PENDING_VALIDATION",
  "created_at": "2026-08-13T10:00:00Z",
  "created_by": { "actor_type": "HUMAN", "actor_id": "platform-admin-1" },
  "updated_at": "2026-08-13T10:00:00Z",
  "updated_by": { "actor_type": "HUMAN", "actor_id": "platform-admin-1" }
}
